company,clean_name,sblo_name,email,search_query,vendor_registration_url,portal_type,notes
JACOBS ENGINEERING GROUP INC.,JACOBS ENGINEERING GROUP,Willie Franklin,,"""JACOBS ENGINEERING GROUP"" supplier portal vendor registration",https://www.jacobs.com/contact/suppliers,Full Portal,Uses SAP Ariba Network for vendor registration. Official supplier contact page provides registration information and links to Ariba portal. No requirement to reach 100% profile completeness to conduct business.
"Jacobs Engineering Group, Inc.",Jacobs Engineering Group,Willie FranklinWillie; Lauren Terrylauren; Willie Franklin; Lori Crumplori,Crumplori.crump@jacobs.comContract; FranklinWillie.franklin@jacobs.comSmall; Terrylauren.terry@jacobs.comSmall; Willie.franklin@jacobs.com,"""Jacobs Engineering Group"" supplier portal vendor registration",https://www.jacobs.com/contact/suppliers,Full Portal,Uses SAP Ariba Network for vendor registration. Official supplier contact page provides registration information and links to Ariba portal. No requirement to reach 100% profile completeness to conduct business.
KPMG,KPMG,Tina Ho; Tina Hotinanho; Kyle Petroskekpetroske,Hotinanho@KPMG.comSmall; Petroskekpetroske@KPMG.comWebsite; tinanho@KPMG.com,"""KPMG"" supplier portal vendor registration",https://kpmg.supplierone.co/,Full Portal,Uses Coupa Supplier Portal (CSP) for transactions. Supplier diversity registration at kpmg.supplierone.co. Invitation-based system; no charge to use portal.
L3Harris,L3Harris,Paul Ray; Paul Raypaul,Raypaul.ray@l3harris.comWebsite; paul.ray@l3harris.com,"""L3Harris"" supplier portal vendor registration",https://suppliers.l3harris.com/supplier-info/supplier_registration.aspx,Email Registration,Submit Vendor Selection Form to SHR.VendorManagement.mas@L3Harris.com. Multiple division-specific portals available. Supplier Vetting Management (SVM) portal for qualification.
Leidos,Leidos,Rebecca Thompson; Rebecca Thompsonsbcomp,Thompsonsbcomp@leidos.comRebecca.a.thompson; sbcomp@leidos.com,"""Leidos"" supplier portal vendor registration",https://www.leidos.com/suppliers,Full Portal,Uses JAGGAER portal system. Invitation-based registration by Leidos team member required. Main portal: solutions.sciquest.com/apps/Router/SupplierLogin?CustOrg=Leidos. Support: Jaggaer@Leidos.com
